{
  "$schema": "https://json-schema.org/draft/2020-12/schema",
  "$id": "https://raw.githubusercontent.com/nagare-project/Nagare_Source/main/schema/candidate-v1.schema.json",
  "title": "Nagare candidate v1",
  "type": "object",
  "additionalProperties": false,
  "required": ["schema", "id", "sourceId", "tier", "matchConfidence", "match", "transport", "metadata"],
  "properties": {
    "schema": { "const": "nagare-candidate/v1" },
    "id": { "type": "string", "minLength": 1, "maxLength": 256 },
    "sourceId": { "type": "string", "pattern": "^[a-z0-9][a-z0-9-]{1,62}$" },
    "tier": { "type": "integer", "minimum": 0, "maximum": 9 },
    "matchConfidence": { "type": "number", "minimum": 0, "maximum": 1 },
    "match": {
      "type": "object",
      "additionalProperties": false,
      "required": ["basis"],
      "properties": {
        "basis": {
          "type": "array",
          "minItems": 1,
          "uniqueItems": true,
          "items": { "enum": ["episode_id", "subject_id", "title_episode", "air_date"] }
        },
        "subjectTitle": { "type": "string", "minLength": 1 },
        "episodeNumber": { "type": "number", "exclusiveMinimum": 0 },
        "evidence": { "type": "string", "minLength": 1, "maxLength": 512 }
      }
    },
    "transport": {
      "oneOf": [
        { "$ref": "#/$defs/hlsTransport" },
        { "$ref": "#/$defs/httpTransport" },
        { "$ref": "#/$defs/torrentTransport" }
      ]
    },
    "metadata": {
      "type": "object",
      "additionalProperties": false,
      "properties": {
        "resolution": { "$ref": "#/$defs/resolution" },
        "subtitleLanguages": {
          "type": "array",
          "uniqueItems": true,
          "items": { "type": "string", "pattern": "^[A-Za-z]{2,3}(?:-[A-Za-z0-9]{2,8})*$" }
        },
        "channel": { "type": "string", "minLength": 1 },
        "channelTier": { "type": "integer", "minimum": 0, "maximum": 99 },
        "episode": { "type": "number", "exclusiveMinimum": 0 },
        "fansub": { "type": "string", "minLength": 1 },
        "sizeBytes": { "type": "integer", "minimum": 0 },
        "seeders": { "type": "integer", "minimum": 0 },
        "publishedAt": { "type": "string", "format": "date-time" }
      }
    }
  },
  "$defs": {
    "headers": {
      "type": "object",
      "propertyNames": { "pattern": "^[!#$%&'*+.^_`|~0-9A-Za-z-]+$" },
      "additionalProperties": { "type": "string" }
    },
    "resolution": {
      "type": "string",
      "enum": ["360P", "480P", "720P", "1080P", "1440P", "2160P"]
    },
    "hlsTransport": {
      "type": "object",
      "additionalProperties": false,
      "required": ["type", "url"],
      "properties": {
        "type": { "const": "hls" },
        "url": { "type": "string", "format": "uri", "pattern": "^https?://" },
        "headers": { "$ref": "#/$defs/headers" },
        "expiresAt": { "type": "integer", "minimum": 0 }
      }
    },
    "httpTransport": {
      "type": "object",
      "additionalProperties": false,
      "required": ["type", "url"],
      "properties": {
        "type": { "const": "http" },
        "url": { "type": "string", "format": "uri", "pattern": "^https?://" },
        "headers": { "$ref": "#/$defs/headers" },
        "expiresAt": { "type": "integer", "minimum": 0 }
      }
    },
    "torrentTransport": {
      "type": "object",
      "additionalProperties": false,
      "required": ["type"],
      "properties": {
        "type": { "const": "torrent" },
        "magnet": { "type": "string", "pattern": "^magnet:\\?" },
        "infoHash": { "type": "string", "pattern": "^(?:[A-Fa-f0-9]{40}|[A-Za-z2-7]{32})$" },
        "torrentUrl": { "type": "string", "format": "uri", "pattern": "^https?://" },
        "fileIndex": { "type": "integer", "minimum": 0 },
        "trackers": {
          "type": "array",
          "uniqueItems": true,
          "items": { "type": "string", "format": "uri" }
        }
      },
      "anyOf": [
        { "required": ["magnet"] },
        { "required": ["infoHash"] },
        { "required": ["torrentUrl"] }
      ]
    }
  }
}
